{
  "schema_name": "provider_p1_readiness_review",
  "schema_version": "1.0.0",
  "generated_at": "2026-05-29T01:00:00Z",
  "scope": {
    "phase": "7b",
    "purpose": "provider_p1_readiness_review_matrix",
    "review_status": "p1_synthesis_matrix",
    "p1_snapshot_collection_status": "six_snapshots_reviewed",
    "provider_selection_allowed": false,
    "paid_access_approved": false,
    "data_fetch_allowed": false,
    "provider_adapter_allowed": false,
    "datahub_table_implementation_allowed": false,
    "runner_change_allowed": false,
    "strategy_rule_change_allowed": false,
    "broker_or_order_automation_allowed": false,
    "manual_order_only": true,
    "ship_gate_relaxed": false,
    "phase7c_authorized_by_this_artifact": false
  },
  "source_snapshot_refs": [
    {
      "snapshot_id": "p1_public_sources_20260528",
      "path": "docs/provider_evidence_p1_us_public_sources_20260528.json",
      "evidence_focus": "SEC EDGAR, SEC ticker files, Nasdaq Trader symbol directory, and GICS methodology public-source evidence.",
      "p1_record_count": 5,
      "schema_ref": "schemas/provider_evidence_drift_monitor.schema.json"
    },
    {
      "snapshot_id": "p1_market_data_candidates_20260528",
      "path": "docs/provider_evidence_p1_us_market_data_candidates_20260528.json",
      "evidence_focus": "Massive / Polygon and Norgate market-data, security-master, adjusted EOD, corporate-action, calendar, survivorship, and index-membership candidate evidence.",
      "p1_record_count": 6,
      "schema_ref": "schemas/provider_evidence_drift_monitor.schema.json"
    },
    {
      "snapshot_id": "p1_authorization_cost_stability_20260528",
      "path": "docs/provider_evidence_p1_us_authorization_cost_stability_20260528.json",
      "evidence_focus": "Massive / Polygon and Norgate authorization, cost, trial, access, license, export, retention, stability, and Norgate latest-only fundamentals evidence.",
      "p1_record_count": 4,
      "schema_ref": "schemas/provider_evidence_drift_monitor.schema.json"
    },
    {
      "snapshot_id": "p1_benchmark_gics_candidates_20260528",
      "path": "docs/provider_evidence_p1_us_benchmark_gics_candidates_20260528.json",
      "evidence_focus": "S&P DJI, Nasdaq, FTSE Russell / LSEG benchmark-source candidate evidence and S&P Global / MSCI GICS candidate evidence.",
      "p1_record_count": 5,
      "schema_ref": "schemas/provider_evidence_drift_monitor.schema.json"
    },
    {
      "snapshot_id": "p1_fundamentals_observed_date_candidates_20260528",
      "path": "docs/provider_evidence_p1_us_fundamentals_observed_date_candidates_20260528.json",
      "evidence_focus": "SEC public reconstruction, Intrinio filing fundamentals, FMP SEC filings / as-reported statements, and Nasdaq Data Link / Sharadar fundamentals candidate context.",
      "p1_record_count": 5,
      "schema_ref": "schemas/provider_evidence_drift_monitor.schema.json"
    },
    {
      "snapshot_id": "p1_coverage_fallback_incident_candidates_20260528",
      "path": "docs/provider_evidence_p1_us_coverage_fallback_incident_candidates_20260528.json",
      "evidence_focus": "Intrinio, FMP, Massive, Norgate, and Nasdaq Data Link coverage, status, fallback, error-code, license, and sample-row validation evidence.",
      "p1_record_count": 6,
      "schema_ref": "schemas/provider_evidence_drift_monitor.schema.json"
    }
  ],
  "review_dimensions": [
    {
      "area_id": "security_master_survivorship",
      "required_for_lanes": [
        "us_long_core_quality",
        "us_long_re_rating_catalyst",
        "us_short_steady",
        "us_burst_full_data",
        "phase7_shared"
      ],
      "required_lineage_or_evidence_fields": [
        "provider_symbol_or_identifier",
        "as_of_eligibility_rule",
        "pit_status",
        "coverage_count",
        "missing_required_fields",
        "known_provider_limitations",
        "authorization_license_class",
        "fallback_path",
        "incident_log_ref"
      ],
      "source_record_refs": [
        {
          "snapshot_id": "p1_public_sources_20260528",
          "record_ids": [
            "p1.us_sec_company_tickers_exchange",
            "p1.us_nasdaq_symbol_directory"
          ]
        },
        {
          "snapshot_id": "p1_market_data_candidates_20260528",
          "record_ids": [
            "p1.us_massive_tickers_security_master",
            "p1.us_norgate_survivorship_eod"
          ]
        },
        {
          "snapshot_id": "p1_coverage_fallback_incident_candidates_20260528",
          "record_ids": [
            "p1.us_massive_coverage_status_fallback_candidate",
            "p1.us_norgate_coverage_fallback_limitations_candidate"
          ]
        }
      ],
      "current_status": "candidate_evidence_partial",
      "readiness_summary": "Massive / Polygon and Norgate are the strongest documented candidates for historical ticker or survivorship surfaces, while SEC and Nasdaq public files are useful current-reference aids. None proves a complete point-in-time security master for the project.",
      "blocking_gaps": [
        "Exact active and inactive common-equity coverage counts over the intended backtest window.",
        "Ticker-change, merger, bankruptcy, OTC transition, ADR, ETF, SPAC, preferred, and fund classification policy.",
        "Durable identifier mapping across providers, including CIK, FIGI, exchange ticker, and any missing CUSIP constraints.",
        "Sample rows proving delisting and listing-state behavior with as-of eligibility and local-storage permission."
      ],
      "datahub_consumption_allowed": false,
      "provider_selection_made": false,
      "next_required_action": [
        "Define a sample-row validation plan for candidate security-master providers.",
        "Resolve license and local-storage permission before any DataHub security-master schema consumes these fields."
      ]
    },
    {
      "area_id": "adjusted_eod_ohlcv_liquidity",
      "required_for_lanes": [
        "us_long_core_quality",
        "us_long_re_rating_catalyst",
        "us_short_steady",
        "us_burst_full_data",
        "phase7_shared"
      ],
      "required_lineage_or_evidence_fields": [
        "provider_id",
        "provider_product_or_tier",
        "endpoint_or_table",
        "source_date_range",
        "frequency",
        "currency",
        "unit",
        "adjustment_mode",
        "row_count",
        "coverage_count",
        "retry_stability_status"
      ],
      "source_record_refs": [
        {
          "snapshot_id": "p1_market_data_candidates_20260528",
          "record_ids": [
            "p1.us_massive_adjusted_ohlcv",
            "p1.us_norgate_survivorship_eod"
          ]
        },
        {
          "snapshot_id": "p1_authorization_cost_stability_20260528",
          "record_ids": [
            "p1.us_massive_authorization_cost_quota",
            "p1.us_norgate_authorization_cost_access"
          ]
        },
        {
          "snapshot_id": "p1_coverage_fallback_incident_candidates_20260528",
          "record_ids": [
            "p1.us_massive_coverage_status_fallback_candidate",
            "p1.us_norgate_coverage_fallback_limitations_candidate"
          ]
        }
      ],
      "current_status": "candidate_evidence_partial",
      "readiness_summary": "Massive / Polygon has documented adjusted aggregate bars and Norgate has documented survivorship-aware EOD packages. Both remain candidate-only because actual coverage counts, adjustment reproducibility, subscription/license status, and endpoint/sample validation are missing.",
      "blocking_gaps": [
        "Dividend-adjusted total-return policy and reconciliation between corporate actions and adjusted bars.",
        "Missing-bar, halt, holiday, zero-volume, and delisted-security behavior across the target history window.",
        "Norgate is EOD-only and Windows / subscription constrained, so it cannot satisfy intraday or live needs alone.",
        "Massive / Polygon plan tier, local-storage, professional-status, and non-display constraints are unresolved."
      ],
      "datahub_consumption_allowed": false,
      "provider_selection_made": false,
      "next_required_action": [
        "Prepare cost/license/sample-row review for the shortlisted market-data candidates.",
        "Keep any eventual DataHub EOD contract separate from this docs-only matrix."
      ]
    },
    {
      "area_id": "corporate_actions_capital_actions",
      "required_for_lanes": [
        "us_long_core_quality",
        "us_long_re_rating_catalyst",
        "us_short_steady",
        "us_burst_full_data",
        "phase7_shared"
      ],
      "required_lineage_or_evidence_fields": [
        "endpoint_or_table",
        "source_date_range",
        "frequency",
        "adjustment_mode",
        "pit_status",
        "as_of_eligibility_rule",
        "coverage_count",
        "known_provider_limitations",
        "drift_monitor_ref"
      ],
      "source_record_refs": [
        {
          "snapshot_id": "p1_market_data_candidates_20260528",
          "record_ids": [
            "p1.us_massive_corporate_actions"
          ]
        },
        {
          "snapshot_id": "p1_authorization_cost_stability_20260528",
          "record_ids": [
            "p1.us_massive_authorization_cost_quota",
            "p1.us_norgate_authorization_cost_access"
          ]
        }
      ],
      "current_status": "candidate_evidence_partial",
      "readiness_summary": "Massive / Polygon docs support dividends and splits as candidate surfaces. Broader capital actions and point-in-time revision behavior remain unresolved, and Norgate package access requires separate validation.",
      "blocking_gaps": [
        "Spin-off, merger, rights, name-change, share-class, and delisting event coverage.",
        "Revision timing and whether corporate-action data can be reconstructed as-of the decision date.",